{
  "schemaVersion": "1.0-development",
  "registryVersion": "0.1.0-development",
  "lifecycle": "Development",
  "stableBaseline": "1.7.0",
  "consumerEligible": false,
  "namespaces": {
    "ui": "Reusable interface icons",
    "glyph": "Compact semantic and status glyphs",
    "identity": "References to separately governed first-party identity assets"
  },
  "fallbackPolicy": {
    "unknownId": "glyph.status.unavailable",
    "networkRequired": false,
    "missingVariant": "default"
  },
  "entries": [
    {
      "id": "ui.action.search",
      "namespace": "ui",
      "concept": "search",
      "category": "action",
      "meaning": "Search",
      "source": {
        "kind": "svg-symbol",
        "asset": "assets/icon-glyphs/system-symbols.svg",
        "symbol": "search",
        "sha256": "9750270f3f744e3bc7f64d66f2afeecfbf55c92efa72a9e67c453af38ae90191"
      },
      "opticalSizes": [
        "micro",
        "compact",
        "standard",
        "display"
      ],
      "variants": [
        "outline",
        "monochrome"
      ],
      "rtl": {
        "behavior": "preserve"
      },
      "accessibility": {
        "defaultName": "Search",
        "decorativeAllowed": true,
        "colorIndependent": true
      },
      "theme": {
        "modes": [
          "light",
          "dark",
          "deep-dark"
        ],
        "highContrast": true,
        "forcedColors": true,
        "reducedTransparency": true
      },
      "semantic": {
        "role": null,
        "colorToken": null
      },
      "provenance": {
        "owner": "GoreeCloud",
        "origin": "first-party-original",
        "usageRights": "GoreeCloud-first-party-use; qualification review required before Stable",
        "reviewState": "development-source"
      },
      "lifecycle": {
        "status": "development",
        "introduced": "0.1.0-development"
      }
    },
    {
      "id": "ui.action.share",
      "namespace": "ui",
      "concept": "share",
      "category": "action",
      "meaning": "Share",
      "source": {
        "kind": "svg-symbol",
        "asset": "assets/icon-glyphs/system-symbols.svg",
        "symbol": "share",
        "sha256": "9750270f3f744e3bc7f64d66f2afeecfbf55c92efa72a9e67c453af38ae90191"
      },
      "opticalSizes": [
        "micro",
        "compact",
        "standard",
        "display"
      ],
      "variants": [
        "outline",
        "monochrome"
      ],
      "rtl": {
        "behavior": "preserve"
      },
      "accessibility": {
        "defaultName": "Share",
        "decorativeAllowed": true,
        "colorIndependent": true
      },
      "theme": {
        "modes": [
          "light",
          "dark",
          "deep-dark"
        ],
        "highContrast": true,
        "forcedColors": true,
        "reducedTransparency": true
      },
      "semantic": {
        "role": null,
        "colorToken": null
      },
      "provenance": {
        "owner": "GoreeCloud",
        "origin": "first-party-original",
        "usageRights": "GoreeCloud-first-party-use; qualification review required before Stable",
        "reviewState": "development-source"
      },
      "lifecycle": {
        "status": "development",
        "introduced": "0.1.0-development"
      }
    },
    {
      "id": "ui.action.delete",
      "namespace": "ui",
      "concept": "delete",
      "category": "action",
      "meaning": "Delete",
      "source": {
        "kind": "svg-symbol",
        "asset": "assets/icon-glyphs/system-symbols.svg",
        "symbol": "delete",
        "sha256": "9750270f3f744e3bc7f64d66f2afeecfbf55c92efa72a9e67c453af38ae90191"
      },
      "opticalSizes": [
        "micro",
        "compact",
        "standard",
        "display"
      ],
      "variants": [
        "outline",
        "monochrome"
      ],
      "rtl": {
        "behavior": "preserve"
      },
      "accessibility": {
        "defaultName": "Delete",
        "decorativeAllowed": true,
        "colorIndependent": true
      },
      "theme": {
        "modes": [
          "light",
          "dark",
          "deep-dark"
        ],
        "highContrast": true,
        "forcedColors": true,
        "reducedTransparency": true
      },
      "semantic": {
        "role": null,
        "colorToken": null
      },
      "provenance": {
        "owner": "GoreeCloud",
        "origin": "first-party-original",
        "usageRights": "GoreeCloud-first-party-use; qualification review required before Stable",
        "reviewState": "development-source"
      },
      "lifecycle": {
        "status": "development",
        "introduced": "0.1.0-development"
      }
    },
    {
      "id": "ui.navigation.back",
      "namespace": "ui",
      "concept": "back",
      "category": "navigation",
      "meaning": "Back",
      "source": {
        "kind": "svg-symbol",
        "asset": "assets/icon-glyphs/system-symbols.svg",
        "symbol": "back",
        "sha256": "9750270f3f744e3bc7f64d66f2afeecfbf55c92efa72a9e67c453af38ae90191"
      },
      "opticalSizes": [
        "micro",
        "compact",
        "standard",
        "display"
      ],
      "variants": [
        "outline",
        "monochrome"
      ],
      "rtl": {
        "behavior": "mirror"
      },
      "accessibility": {
        "defaultName": "Back",
        "decorativeAllowed": true,
        "colorIndependent": true
      },
      "theme": {
        "modes": [
          "light",
          "dark",
          "deep-dark"
        ],
        "highContrast": true,
        "forcedColors": true,
        "reducedTransparency": true
      },
      "semantic": {
        "role": null,
        "colorToken": null
      },
      "provenance": {
        "owner": "GoreeCloud",
        "origin": "first-party-original",
        "usageRights": "GoreeCloud-first-party-use; qualification review required before Stable",
        "reviewState": "development-source"
      },
      "lifecycle": {
        "status": "development",
        "introduced": "0.1.0-development"
      }
    },
    {
      "id": "ui.navigation.forward",
      "namespace": "ui",
      "concept": "forward",
      "category": "navigation",
      "meaning": "Forward",
      "source": {
        "kind": "svg-symbol",
        "asset": "assets/icon-glyphs/system-symbols.svg",
        "symbol": "forward",
        "sha256": "9750270f3f744e3bc7f64d66f2afeecfbf55c92efa72a9e67c453af38ae90191"
      },
      "opticalSizes": [
        "micro",
        "compact",
        "standard",
        "display"
      ],
      "variants": [
        "outline",
        "monochrome"
      ],
      "rtl": {
        "behavior": "mirror"
      },
      "accessibility": {
        "defaultName": "Forward",
        "decorativeAllowed": true,
        "colorIndependent": true
      },
      "theme": {
        "modes": [
          "light",
          "dark",
          "deep-dark"
        ],
        "highContrast": true,
        "forcedColors": true,
        "reducedTransparency": true
      },
      "semantic": {
        "role": null,
        "colorToken": null
      },
      "provenance": {
        "owner": "GoreeCloud",
        "origin": "first-party-original",
        "usageRights": "GoreeCloud-first-party-use; qualification review required before Stable",
        "reviewState": "development-source"
      },
      "lifecycle": {
        "status": "development",
        "introduced": "0.1.0-development"
      }
    },
    {
      "id": "ui.system.settings",
      "namespace": "ui",
      "concept": "settings",
      "category": "system",
      "meaning": "Settings",
      "source": {
        "kind": "svg-symbol",
        "asset": "assets/icon-glyphs/system-symbols.svg",
        "symbol": "settings",
        "sha256": "9750270f3f744e3bc7f64d66f2afeecfbf55c92efa72a9e67c453af38ae90191"
      },
      "opticalSizes": [
        "micro",
        "compact",
        "standard",
        "display"
      ],
      "variants": [
        "outline",
        "monochrome"
      ],
      "rtl": {
        "behavior": "preserve"
      },
      "accessibility": {
        "defaultName": "Settings",
        "decorativeAllowed": true,
        "colorIndependent": true
      },
      "theme": {
        "modes": [
          "light",
          "dark",
          "deep-dark"
        ],
        "highContrast": true,
        "forcedColors": true,
        "reducedTransparency": true
      },
      "semantic": {
        "role": null,
        "colorToken": null
      },
      "provenance": {
        "owner": "GoreeCloud",
        "origin": "first-party-original",
        "usageRights": "GoreeCloud-first-party-use; qualification review required before Stable",
        "reviewState": "development-source"
      },
      "lifecycle": {
        "status": "development",
        "introduced": "0.1.0-development"
      }
    },
    {
      "id": "ui.object.cloud",
      "namespace": "ui",
      "concept": "cloud",
      "category": "object",
      "meaning": "Cloud",
      "source": {
        "kind": "svg-symbol",
        "asset": "assets/icon-glyphs/system-symbols.svg",
        "symbol": "cloud",
        "sha256": "9750270f3f744e3bc7f64d66f2afeecfbf55c92efa72a9e67c453af38ae90191"
      },
      "opticalSizes": [
        "micro",
        "compact",
        "standard",
        "display"
      ],
      "variants": [
        "outline",
        "monochrome"
      ],
      "rtl": {
        "behavior": "preserve"
      },
      "accessibility": {
        "defaultName": "Cloud",
        "decorativeAllowed": true,
        "colorIndependent": true
      },
      "theme": {
        "modes": [
          "light",
          "dark",
          "deep-dark"
        ],
        "highContrast": true,
        "forcedColors": true,
        "reducedTransparency": true
      },
      "semantic": {
        "role": null,
        "colorToken": null
      },
      "provenance": {
        "owner": "GoreeCloud",
        "origin": "first-party-original",